{
  "catalogVersion": 1,
  "serial": 2,
  "plugins": [
    {
      "id": "skiller",
      "displayName": "Skiller",
      "description": "Learns from an agent chat session and proposes a better, session-agnostic version of the built-in skill it used. Nothing changes until a person approves it.",
      "icon": {
        "url": "https://raw.githubusercontent.com/samugit83/redamon-plugins/master/skiller/icon.jpg",
        "sha256": "e4d591add80435def809a308b168273f941a6c68d187eff9d6c419fdbbed6e43",
        "size": 43586,
        "type": "image/jpeg"
      },
      "docsUrl": "https://github.com/samugit83/redamon/wiki/Plugin-Skiller",
      "releases": [
        {
          "version": "1.0.0",
          "platform": ">=1.0.0 <2.0.0",
          "dataVersion": 1,
          "url": "https://github.com/samugit83/redamon-plugins/releases/download/skiller-v1.0.0/skiller-1.0.0.tar.gz",
          "sha256": "5e1aaa40ba89bf098b782232b49739c5710245ebe49fa00f76211bb803747b4b",
          "size": 39852,
          "permissions": [
            "session:read",
            "llm:invoke",
            "override:skill.text"
          ]
        }
      ]
    }
  ],
  "revoked": []
}
